{
  "graph": {
    "name": "factory_small_seed1",
    "seed": 1,
    "size": "small"
  },
  "nodes": [
    {
      "id": "P01",
      "type": "process",
      "layer": 2,
      "branch": "A",
      "line": "LA1",
      "step": 1,
      "wip_buffer_true": 0.037
    },
    {
      "id": "P02",
      "type": "process",
      "layer": 2,
      "branch": "A",
      "line": "LA1",
      "step": 2,
      "wip_buffer_true": 0.132
    },
    {
      "id": "P03",
      "type": "process",
      "layer": 2,
      "branch": "A",
      "line": "LA1",
      "step": 3,
      "wip_buffer_true": 0.092
    },
    {
      "id": "M01",
      "type": "machine",
      "layer": 1,
      "branch": "A",
      "line": "LA1",
      "machine_type": "M",
      "spare_capacity": 0.482,
      "alt_machines": [
        "M02"
      ]
    },
    {
      "id": "S_M01_air_temp",
      "type": "sensor",
      "layer": 0,
      "branch": "A",
      "measures": "air_temp"
    },
    {
      "id": "S_M01_process_temp",
      "type": "sensor",
      "layer": 0,
      "branch": "A",
      "measures": "process_temp"
    },
    {
      "id": "S_M01_rot_speed",
      "type": "sensor",
      "layer": 0,
      "branch": "A",
      "measures": "rot_speed"
    },
    {
      "id": "S_M01_torque",
      "type": "sensor",
      "layer": 0,
      "branch": "A",
      "measures": "torque"
    },
    {
      "id": "S_M01_tool_wear",
      "type": "sensor",
      "layer": 0,
      "branch": "A",
      "measures": "tool_wear"
    },
    {
      "id": "M02",
      "type": "machine",
      "layer": 1,
      "branch": "A",
      "line": "LA1",
      "machine_type": "M",
      "spare_capacity": 0.467,
      "alt_machines": [
        "M01"
      ]
    },
    {
      "id": "S_M02_air_temp",
      "type": "sensor",
      "layer": 0,
      "branch": "A",
      "measures": "air_temp"
    },
    {
      "id": "S_M02_process_temp",
      "type": "sensor",
      "layer": 0,
      "branch": "A",
      "measures": "process_temp"
    },
    {
      "id": "S_M02_rot_speed",
      "type": "sensor",
      "layer": 0,
      "branch": "A",
      "measures": "rot_speed"
    },
    {
      "id": "S_M02_torque",
      "type": "sensor",
      "layer": 0,
      "branch": "A",
      "measures": "torque"
    },
    {
      "id": "S_M02_tool_wear",
      "type": "sensor",
      "layer": 0,
      "branch": "A",
      "measures": "tool_wear"
    },
    {
      "id": "M03",
      "type": "machine",
      "layer": 1,
      "branch": "A",
      "line": "LA1",
      "machine_type": "H",
      "spare_capacity": 0.05,
      "alt_machines": []
    },
    {
      "id": "S_M03_air_temp",
      "type": "sensor",
      "layer": 0,
      "branch": "A",
      "measures": "air_temp"
    },
    {
      "id": "S_M03_process_temp",
      "type": "sensor",
      "layer": 0,
      "branch": "A",
      "measures": "process_temp"
    },
    {
      "id": "S_M03_rot_speed",
      "type": "sensor",
      "layer": 0,
      "branch": "A",
      "measures": "rot_speed"
    },
    {
      "id": "S_M03_torque",
      "type": "sensor",
      "layer": 0,
      "branch": "A",
      "measures": "torque"
    },
    {
      "id": "S_M03_tool_wear",
      "type": "sensor",
      "layer": 0,
      "branch": "A",
      "measures": "tool_wear"
    },
    {
      "id": "M04",
      "type": "machine",
      "layer": 1,
      "branch": "A",
      "line": "LA1",
      "machine_type": "L",
      "spare_capacity": 0.379,
      "alt_machines": [
        "M05"
      ]
    },
    {
      "id": "S_M04_air_temp",
      "type": "sensor",
      "layer": 0,
      "branch": "A",
      "measures": "air_temp"
    },
    {
      "id": "S_M04_process_temp",
      "type": "sensor",
      "layer": 0,
      "branch": "A",
      "measures": "process_temp"
    },
    {
      "id": "S_M04_rot_speed",
      "type": "sensor",
      "layer": 0,
      "branch": "A",
      "measures": "rot_speed"
    },
    {
      "id": "S_M04_torque",
      "type": "sensor",
      "layer": 0,
      "branch": "A",
      "measures": "torque"
    },
    {
      "id": "S_M04_tool_wear",
      "type": "sensor",
      "layer": 0,
      "branch": "A",
      "measures": "tool_wear"
    },
    {
      "id": "M05",
      "type": "machine",
      "layer": 1,
      "branch": "A",
      "line": "LA1",
      "machine_type": "L",
      "spare_capacity": 0.113,
      "alt_machines": [
        "M04"
      ]
    },
    {
      "id": "S_M05_air_temp",
      "type": "sensor",
      "layer": 0,
      "branch": "A",
      "measures": "air_temp"
    },
    {
      "id": "S_M05_process_temp",
      "type": "sensor",
      "layer": 0,
      "branch": "A",
      "measures": "process_temp"
    },
    {
      "id": "S_M05_rot_speed",
      "type": "sensor",
      "layer": 0,
      "branch": "A",
      "measures": "rot_speed"
    },
    {
      "id": "S_M05_torque",
      "type": "sensor",
      "layer": 0,
      "branch": "A",
      "measures": "torque"
    },
    {
      "id": "S_M05_tool_wear",
      "type": "sensor",
      "layer": 0,
      "branch": "A",
      "measures": "tool_wear"
    },
    {
      "id": "P04",
      "type": "process",
      "layer": 2,
      "branch": "A",
      "line": "LA2",
      "step": 1,
      "wip_buffer_true": 0.194
    },
    {
      "id": "P05",
      "type": "process",
      "layer": 2,
      "branch": "A",
      "line": "LA2",
      "step": 2,
      "wip_buffer_true": 0.2
    },
    {
      "id": "P06",
      "type": "process",
      "layer": 2,
      "branch": "A",
      "line": "LA2",
      "step": 3,
      "wip_buffer_true": 0.014
    },
    {
      "id": "M06",
      "type": "machine",
      "layer": 1,
      "branch": "A",
      "line": "LA2",
      "machine_type": "L",
      "spare_capacity": 0.038,
      "alt_machines": [
        "M07",
        "M08",
        "M09",
        "M11"
      ]
    },
    {
      "id": "S_M06_air_temp",
      "type": "sensor",
      "layer": 0,
      "branch": "A",
      "measures": "air_temp"
    },
    {
      "id": "S_M06_process_temp",
      "type": "sensor",
      "layer": 0,
      "branch": "A",
      "measures": "process_temp"
    },
    {
      "id": "S_M06_rot_speed",
      "type": "sensor",
      "layer": 0,
      "branch": "A",
      "measures": "rot_speed"
    },
    {
      "id": "S_M06_torque",
      "type": "sensor",
      "layer": 0,
      "branch": "A",
      "measures": "torque"
    },
    {
      "id": "S_M06_tool_wear",
      "type": "sensor",
      "layer": 0,
      "branch": "A",
      "measures": "tool_wear"
    },
    {
      "id": "M07",
      "type": "machine",
      "layer": 1,
      "branch": "A",
      "line": "LA2",
      "machine_type": "L",
      "spare_capacity": 0.329,
      "alt_machines": [
        "M06",
        "M08",
        "M09",
        "M11"
      ]
    },
    {
      "id": "S_M07_air_temp",
      "type": "sensor",
      "layer": 0,
      "branch": "A",
      "measures": "air_temp"
    },
    {
      "id": "S_M07_process_temp",
      "type": "sensor",
      "layer": 0,
      "branch": "A",
      "measures": "process_temp"
    },
    {
      "id": "S_M07_rot_speed",
      "type": "sensor",
      "layer": 0,
      "branch": "A",
      "measures": "rot_speed"
    },
    {
      "id": "S_M07_torque",
      "type": "sensor",
      "layer": 0,
      "branch": "A",
      "measures": "torque"
    },
    {
      "id": "S_M07_tool_wear",
      "type": "sensor",
      "layer": 0,
      "branch": "A",
      "measures": "tool_wear"
    },
    {
      "id": "M08",
      "type": "machine",
      "layer": 1,
      "branch": "A",
      "line": "LA2",
      "machine_type": "L",
      "spare_capacity": 0.21,
      "alt_machines": [
        "M06",
        "M07",
        "M09",
        "M11"
      ]
    },
    {
      "id": "S_M08_air_temp",
      "type": "sensor",
      "layer": 0,
      "branch": "A",
      "measures": "air_temp"
    },
    {
      "id": "S_M08_process_temp",
      "type": "sensor",
      "layer": 0,
      "branch": "A",
      "measures": "process_temp"
    },
    {
      "id": "S_M08_rot_speed",
      "type": "sensor",
      "layer": 0,
      "branch": "A",
      "measures": "rot_speed"
    },
    {
      "id": "S_M08_torque",
      "type": "sensor",
      "layer": 0,
      "branch": "A",
      "measures": "torque"
    },
    {
      "id": "S_M08_tool_wear",
      "type": "sensor",
      "layer": 0,
      "branch": "A",
      "measures": "tool_wear"
    },
    {
      "id": "M09",
      "type": "machine",
      "layer": 1,
      "branch": "A",
      "line": "LA2",
      "machine_type": "L",
      "spare_capacity": 0.392,
      "alt_machines": [
        "M06",
        "M07",
        "M08",
        "M11"
      ]
    },
    {
      "id": "S_M09_air_temp",
      "type": "sensor",
      "layer": 0,
      "branch": "A",
      "measures": "air_temp"
    },
    {
      "id": "S_M09_process_temp",
      "type": "sensor",
      "layer": 0,
      "branch": "A",
      "measures": "process_temp"
    },
    {
      "id": "S_M09_rot_speed",
      "type": "sensor",
      "layer": 0,
      "branch": "A",
      "measures": "rot_speed"
    },
    {
      "id": "S_M09_torque",
      "type": "sensor",
      "layer": 0,
      "branch": "A",
      "measures": "torque"
    },
    {
      "id": "S_M09_tool_wear",
      "type": "sensor",
      "layer": 0,
      "branch": "A",
      "measures": "tool_wear"
    },
    {
      "id": "M10",
      "type": "machine",
      "layer": 1,
      "branch": "A",
      "line": "LA2",
      "machine_type": "M",
      "spare_capacity": 0.224,
      "alt_machines": []
    },
    {
      "id": "S_M10_air_temp",
      "type": "sensor",
      "layer": 0,
      "branch": "A",
      "measures": "air_temp"
    },
    {
      "id": "S_M10_process_temp",
      "type": "sensor",
      "layer": 0,
      "branch": "A",
      "measures": "process_temp"
    },
    {
      "id": "S_M10_rot_speed",
      "type": "sensor",
      "layer": 0,
      "branch": "A",
      "measures": "rot_speed"
    },